,Title,Published_date,Views,Likes,Comments,Month,Year
236,Entry vs Mid vs Senior Level Data Analyst | Alex The Analyst Show | Episode 15,2020-12-17 12:00:12+00:00,46459,1550,207,Dec,2020
237,Data Engineer vs Data Analyst | Which Is Right For You?,2020-12-15 12:00:08+00:00,81235,2700,145,Dec,2020
238,How to Find Out Your Coworkers Salary | Alex The Analyst Show | Episode 14,2020-12-10 12:00:30+00:00,2798,94,53,Dec,2020
239,Advanced SQL Tutorial | CTE (Common Table Expression),2020-12-08 12:00:05+00:00,321939,5281,181,Dec,2020
240,"Data Analyst Salary (Expectations, Bonuses, 401K, ESPP) | Alex The Analyst Show | Episode 13",2020-12-03 12:00:00+00:00,22994,737,189,Dec,2020
241,Intermediate SQL Tutorial | Partition By,2020-12-01 12:04:43+00:00,259875,6122,195,Dec,2020
242,Data Analyst Q/A LIVE #5 | AMA,2020-11-28 17:07:30+00:00,4833,130,18,Nov,2020
243,Completely REALISTIC Jobs on LinkedIn | Alex The Analyst Show | Episode 12,2020-11-25 11:00:05+00:00,24402,878,162,Nov,2020
244,Completely Unrealistic Jobs on LinkedIn | Alex The Analyst Show | Episode 11,2020-11-19 15:00:26+00:00,14371,568,206,Nov,2020
245,Top 3 Tips on Using LinkedIn to Land a Job,2020-11-17 14:11:52+00:00,270406,10248,223,Nov,2020
246,What is No Code Analytics? | Alex The Analyst Show | Episode 10,2020-11-12 12:34:08+00:00,3794,120,81,Nov,2020
247,Solving LeetCode SQL Interview Questions | Part 1/3,2020-11-10 15:02:50+00:00,24310,640,63,Nov,2020
248,What is Analytics Consulting? With John Ariansen | Alex The Analyst Show | Episode 9,2020-11-05 15:43:17+00:00,12907,377,116,Nov,2020
249,Data Analyst Skills Path | What Skills You NEED to Know,2020-11-03 15:13:12+00:00,76591,3595,275,Nov,2020
250,Data Analyst Q&A LIVE #4,2020-10-30 15:13:53+00:00,3472,105,25,Oct,2020
251,Asking My Wife Your Questions About Me | Alex The Analyst Show | Episode 8,2020-10-27 16:06:53+00:00,13875,553,222,Oct,2020
252,Top 10 Udemy Courses for Data Analysts,2020-10-22 15:14:21+00:00,159016,4651,279,Oct,2020
253,Data Analyst Certifications | Are They Worth It? | Alex The Analyst Show | Episode 7,2020-10-20 14:08:32+00:00,178556,6215,988,Oct,2020
254,Working at a Startup vs Fortune 500 Company | Alex The Analyst Show | Episode 6,2020-10-15 15:33:32+00:00,4650,172,72,Oct,2020
255,Top 10 Coursera Courses for Data Analysts,2020-10-13 14:40:18+00:00,106438,4671,282,Oct,2020
256,Imposter Syndrome in Tech | Alex The Analyst Show | Episode 5,2020-10-08 14:26:27+00:00,7235,361,176,Oct,2020
257,Data Analyst Expectations vs Reality,2020-10-06 14:52:33+00:00,75592,2800,188,Oct,2020
258,Covid and the Data Analyst Job Market | Alex The Analyst Show | Episode 4,2020-10-01 13:53:17+00:00,7202,253,162,Oct,2020
259,Self Taught vs Boot Camp vs Degree | Alex The Analyst Show | Episode 3,2020-09-24 15:29:17+00:00,45115,1508,717,Sep,2020
260,Top 5 Reasons You'll Be a Good Data Analyst,2020-09-22 13:03:29+00:00,14584,611,82,Sep,2020
261,How I Changed Careers to Become a Data Analyst | Alex The Analyst Show | Episode 2,2020-09-10 13:16:00+00:00,415420,12166,3820,Sep,2020
262,Top 5 Reasons Data Analytics is a Good Career Choice,2020-09-08 14:15:55+00:00,44267,1322,74,Sep,2020
263,The Hiring Process from an Interviewer's Perspective | Alex The Analyst Show | Episode 1,2020-09-03 15:38:28+00:00,20436,685,83,Sep,2020
264,Top 5 Reasons Not to Lie on Your Resume,2020-09-01 12:29:45+00:00,11910,204,120,Sep,2020
265,Live Data Analyst Q&A #3,2020-08-29 14:37:52+00:00,2904,100,43,Aug,2020
266,Data Analyst Career Path | How to Become a Data Analyst + What to Do Next,2020-08-20 13:46:16+00:00,130209,4658,273,Aug,2020
267,Top 5 Reasons Not to Become a Data Analyst,2020-08-12 14:52:19+00:00,920954,19763,1053,Aug,2020
268,Data Analyst Bootcamps | Are They Worth It?,2020-08-05 13:14:01+00:00,33807,573,94,Aug,2020
269,What Does a Data Analyst Actually Do?,2020-07-29 13:48:00+00:00,908235,17908,469,Jul,2020
270,Data Analyst Question and Answer | Answering Your YouTube Questions,2020-07-22 14:35:55+00:00,4429,172,67,Jul,2020
271,Scraping Data Off Twitter Using Python | Twitterscraper + NLP + Data Visualization,2020-07-15 14:00:20+00:00,54001,1380,157,Jul,2020
272,Data Analyst vs Business Analyst | Which Is Right For You?,2020-07-03 14:17:52+00:00,747512,19084,579,Jul,2020
273,Best Free Online Courses for Data Analysts,2020-06-23 13:55:50+00:00,56724,2746,95,Jun,2020
274,Best Online Courses for Data Analysts,2020-06-17 14:57:22+00:00,181583,9356,421,Jun,2020
275,Data Scientist vs Data Analyst | Which Is Right For You?,2020-06-10 15:49:15+00:00,773048,24017,858,Jun,2020
276,Intermediate SQL Tutorial | Aliasing,2020-06-04 14:00:10+00:00,143259,3889,99,Jun,2020
277,Data Analyst Q&A LIVE,2020-05-31 13:54:38+00:00,10296,257,54,May,2020
278,Data Analyst Interviews | Salary Negotiation,2020-05-27 15:13:50+00:00,25633,818,27,May,2020
279,Data Analyst Interview Questions | What To Say vs What NOT To Say,2020-05-20 14:03:02+00:00,71231,1728,35,May,2020
280,SQL Interview Questions and Answers for Beginners | Data Analyst Interview Questions,2020-05-13 15:00:26+00:00,120895,3175,110,May,2020
281,Data Analyst Interview Questions | Phone + In-Person Interview Questions,2020-05-06 15:20:18+00:00,78974,1606,64,May,2020
282,Day in the Life of a Data Analyst | Fortune 500 Edition (During Quarantine),2020-04-23 13:08:33+00:00,15145,521,52,Apr,2020
283,Intermediate SQL Tutorial | Updating/Deleting Data,2020-04-16 12:58:52+00:00,147945,3374,140,Apr,2020
284,Intermediate SQL Tutorial | Having Clause,2020-04-09 16:01:02+00:00,173077,4565,83,Apr,2020
285,Intermediate SQL Tutorial | Case Statement | Use Cases,2020-04-02 15:16:37+00:00,282552,6967,426,Apr,2020
286,Intermediate SQL Tutorial | Unions | Union Operator,2020-03-26 16:51:37+00:00,250477,4933,164,Mar,2020
287,Intermediate SQL Tutorial | Inner/Outer Joins | Use Cases,2020-03-19 15:40:58+00:00,506340,8755,466,Mar,2020
288,Day in the Life of a Data Analyst | Fortune 500 Edition,2020-03-11 13:44:54+00:00,125216,2577,266,Mar,2020
289,SQL Basics Tutorial For Beginners | Group By + Order By Statements | 4/4,2020-03-03 15:06:36+00:00,323361,8044,232,Mar,2020
290,SQL Basics Tutorial For Beginners | Where Statement | 3/4,2020-03-02 16:01:01+00:00,341419,6005,155,Mar,2020
291,SQL Basics Tutorial For Beginners | Select + From Statements | 2/4,2020-03-01 17:02:28+00:00,496809,7254,305,Mar,2020
292,SQL Basics Tutorial For Beginners | Installing SQL Server Management Studio and Create Tables | 1/4,2020-03-01 00:50:38+00:00,1372912,17952,2034,Mar,2020
293,Data Analyst Fact Check |  84k Average Starting Salary?? | The Career Force 2020 Data Analyst Salary,2020-02-26 15:11:22+00:00,25817,849,162,Feb,2020
294,Data Analyst Resume | Reviewing YOUR Data Analyst Resumes!,2020-02-24 16:34:51+00:00,25235,538,39,Feb,2020
295,Data Analyst Salary in 2020,2020-02-19 15:43:59+00:00,8135,157,25,Feb,2020
296,Working With a Recruiter to Land Your First Job as a Data Analyst | LinkedIn Recruiters,2020-02-14 18:03:34+00:00,14117,608,39,Feb,2020
297,Switching Careers to Become a Data Analyst | How I Made the Switch,2020-02-11 15:03:18+00:00,48980,1782,249,Feb,2020
298,Data Analyst Resume | Complete Guide To Creating A Data Analyst Resume | Tips + Templates + Examples,2020-02-06 16:00:52+00:00,119331,3495,103,Feb,2020
299,Data Analyst Resume | Reviewing My Resume! | Fortune 500 Data Analyst,2020-01-30 14:07:55+00:00,71619,1667,64,Jan,2020
300,Working at a Big Company Vs Small Company | Told by a Fortune 500 Data Analyst,2020-01-25 16:38:39+00:00,15148,410,22,Jan,2020
301,Data Analyst Salary | 100k with No Experience,2020-01-23 03:16:09+00:00,64274,2186,227,Jan,2020
302,Truth About Big Companies | Told by a Fortune 500 Data Analyst,2020-01-21 03:52:15+00:00,8868,326,19,Jan,2020
303,Top 3 Data Analyst Skills in 2020,2020-01-17 14:31:39+00:00,28890,1401,140,Jan,2020
